collection_id,product,title,link,published_at
165290442832,10,Hawaii Turtle Polynesian Flower Tattoo Beige Collection,Hawaii Turtle Polynesian Flower Tattoo Beige Collection,Tue Jun 23 2020 10:42:56 GMT+0700 (Indochina Time)
164640948304,10,Hawaiian Kanaka Maoli Turtle Collection,Hawaiian Kanaka Maoli Turtle Collection,Mon Jun 01 2020 14:34:13 GMT+0700 (Indochina Time)
165899894864,10,Jamaica Flag Rasta Lion Clothing - Ten Style,Jamaica Flag Rasta Lion Clothing - Ten Style,Sat Jul 11 2020 15:59:55 GMT+0700 (Indochina Time)
164660936784,10,KING KAMEHAMEHA - Tattoo Style Collection,KING KAMEHAMEHA - Tattoo Style Collection,Tue Jun 02 2020 09:32:37 GMT+0700 (Indochina Time)
160105889872,10,Knight Of Colombia Collection,Knight Of Colombia Collection,Wed Mar 18 2020 13:28:24 GMT+0700 (Indochina Time)
160328745040,10,Marshall Islands Special Collection,Marshall Islands Special Collection,Mon Mar 30 2020 14:05:28 GMT+0700 (Indochina Time)
165963923536,10,Norfolk Islands,Norfolk Islands,Tue Jul 14 2020 23:09:00 GMT+0700 (Indochina Time)
160993247312,10,North Macedonia Flag and Map,North Macedonia Flag and Map,Mon Apr 13 2020 11:19:34 GMT+0700 (Indochina Time)
160604749904,10,Obey The Chihuahua,Obey The Chihuahua,Mon Apr 06 2020 17:05:49 GMT+0700 (Indochina Time)
165270224976,10,Papua New Guinea Flag Pillow Case Collection,Papua New Guinea Flag Pillow Case Collection,Mon Jun 22 2020 13:50:38 GMT+0700 (Indochina Time)
158134501456,10,Polynesian Legging Coolest Tattoo Collection,Polynesian Legging Coolest Tattoo Collection,Mon Dec 23 2019 16:36:43 GMT+0700 (Indochina Time)
165268586576,11,1,1,Mon Jun 22 2020 10:13:48 GMT+0700 (Indochina Time)
165470961744,11,123,123,Sat Jun 27 2020 08:07:08 GMT+0700 (Indochina Time)
159903547472,11,All Items About New Mexico,All Items About New Mexico,Sat Mar 07 2020 10:31:45 GMT+0700 (Indochina Time)
161587757136,11,American Samoa Football Collection,American Samoa Football Collection,Tue Apr 21 2020 09:38:30 GMT+0700 (Indochina Time)
161741078608,11,Australia Jigsaw Puzzle Collection,Australia Jigsaw Puzzle Collection,Thu Apr 23 2020 17:58:46 GMT+0700 (Indochina Time)
161332199504,11,Australia Mouth Protection Collection,Australia Mouth Protection Collection,Fri Apr 17 2020 09:28:53 GMT+0700 (Indochina Time)
159875858512,11,Canadian Firefighter 3D,Canadian Firefighter 3D,Fri Mar 06 2020 16:04:01 GMT+0700 (Indochina Time)
161404387408,11,Czech Republic Face Mask,Czech Republic Face Mask,Sat Apr 18 2020 16:46:07 GMT+0700 (Indochina Time)
160845299792,11,Ethiopia Mouth Mask Collection,Ethiopia Mouth Mask Collection,Fri Apr 10 2020 19:43:35 GMT+0700 (Indochina Time)
164252352592,11,Ethiopia The Rasta Lion Tattoo Collection,Ethiopia The Rasta Lion Tattoo Collection,Sat May 23 2020 13:20:31 GMT+0700 (Indochina Time)
164460789840,11,France National Day - Vive la France,France National Day - Vive la France,Wed May 27 2020 10:34:12 GMT+0700 (Indochina Time)
164886610000,11,Freemasonry Collection,Freemasonry Collection,Wed Jun 10 2020 14:08:04 GMT+0700 (Indochina Time)
160165855312,11,French Polynesian Manta Collection,French Polynesian Manta Collection,Sat Mar 21 2020 16:32:44 GMT+0700 (Indochina Time)
60345122885,11,German coins collection,German coins collection,Mon Aug 20 2018 10:34:22 GMT+0700 (Indochina Time)
159855673424,11,Ghana Ankara Tops Striped,Ghana Ankara Tops Striped,Fri Mar 06 2020 07:59:17 GMT+0700 (Indochina Time)
162885861456,11,Graham Tartan Polo Shirt In Me Clan Badge K7,Graham Tartan Polo Shirt In Me Clan Badge K7,Wed May 06 2020 10:22:28 GMT+0700 (Indochina Time)
155437400144,11,Guam Polynesia Collections,Guam Polynesia Collections,Thu Nov 07 2019 17:08:47 GMT+0700 (Indochina Time)
161932378192,11,Hawaii Leggings Collection,Hawaii Leggings Collection,Sun Apr 26 2020 14:49:59 GMT+0700 (Indochina Time)
159982321744,11,Inca Tattoo Style Collection,Inca Tattoo Style Collection,Thu Mar 12 2020 09:57:57 GMT+0700 (Indochina Time)
165104287824,11,Independence Day United States Clothing,Independence Day United States Clothing,Mon Jun 15 2020 14:02:54 GMT+0700 (Indochina Time)
158999511120,11,Ireland Celtic Shamrock Collection,Ireland Celtic Shamrock Collection,Sat Feb 01 2020 08:45:17 GMT+0700 (Indochina Time)
162100543568,11,Ireland Puzzle Jigsaw Collection,Ireland Puzzle Jigsaw Collection,Tue Apr 28 2020 11:36:21 GMT+0700 (Indochina Time)
166306906192,11,Jamaica United Collection,Jamaica United Collection,Wed Jul 22 2020 10:43:07 GMT+0700 (Indochina Time)
159684886608,11,Kanaka Maoli (Hawaii) Hibiscus Turtle Tattoo Black Collection,Kanaka Maoli (Hawaii) Hibiscus Turtle Tattoo Black Collection,Thu Feb 27 2020 08:59:37 GMT+0700 (Indochina Time)
153619333200,11,Kiribati Turtle Tribal Collection,Kiribati Turtle Tribal Collection,Fri Oct 25 2019 08:07:15 GMT+0700 (Indochina Time)
161336328272,11,Marshall Islands Mouth Mask Collection,Marshall Islands Mouth Mask Collection,Fri Apr 17 2020 07:49:27 GMT+0700 (Indochina Time)
161684881488,11,Netherlands Jigsaw Puzzle Collection,Netherlands Jigsaw Puzzle Collection,Wed Apr 22 2020 21:34:49 GMT+0700 (Indochina Time)
160106250320,11,New Zealand Anzac Day Poppy Flower Collection,New Zealand Anzac Day Poppy Flower Collection,Wed Mar 18 2020 14:06:50 GMT+0700 (Indochina Time)
160648396880,11,New Zealand Mouth Mask Collection,New Zealand Mouth Mask Collection,Tue Apr 07 2020 10:11:10 GMT+0700 (Indochina Time)
159906758736,11,Niue Hibiscus Coconut Crab Polynesian,Niue Hibiscus Coconut Crab Polynesian,Sat Mar 07 2020 16:53:24 GMT+0700 (Indochina Time)
57575145541,11,"Norway bedding set- Best selling collection| LoveNorway| 1sttheworld","Norway bedding set- Best selling collection| LoveNorway| 1sttheworld",Sun Jul 29 2018 18:23:29 GMT+0700 (Indochina Time)
159726633040,11,Oromo Rising Collection,Oromo Rising Collection,Sat Feb 29 2020 16:37:34 GMT+0700 (Indochina Time)
135851442256,11,Palau Coconut Collection,Palau Coconut Collection,Tue Jul 30 2019 14:22:57 GMT+0700 (Indochina Time)
166182060112,11,Papua New Guinea Sporty Style Collection,Papua New Guinea Sporty Style Collection,Mon Jul 20 2020 11:13:27 GMT+0700 (Indochina Time)
158651482192,11,Poland Home Collection,Poland Home Collection,Tue Jan 14 2020 09:34:26 GMT+0700 (Indochina Time)
99098886224,11,Polynesian Special Design,Polynesian Special Design,Sat Mar 02 2019 10:31:04 GMT+0700 (Indochina Time)
164983832656,12,Africa Beautiful Black Woman Collection,Africa Beautiful Black Woman Collection,Sat Jun 13 2020 15:22:26 GMT+0700 (Indochina Time)
161995948112,12,Africa Mask Collection,Africa Mask Collection,Mon Apr 27 2020 10:55:55 GMT+0700 (Indochina Time)
130557050960,12,Albania Cannon Style Collection,Albania Cannon Style Collection,Mon May 06 2019 16:00:42 GMT+0700 (Indochina Time)
160188039248,12,Albania Collection,Albania Collection,Mon Mar 23 2020 17:13:14 GMT+0700 (Indochina Time)
129755185232,12,Albania Sneakers Collection,Albania Sneakers Collection,Sat Apr 20 2019 11:50:04 GMT+0700 (Indochina Time)
65189707845,12,Albanian Watches Collection,Albanian Watches Collection,Thu Sep 20 2018 15:24:44 GMT+0700 (Indochina Time)
165593841744,12,Algeria Active Coat Of Arms Collection,Algeria Active Coat Of Arms Collection,Wed Jul 01 2020 13:21:22 GMT+0700 (Indochina Time)
165561040976,12,All Items About Eritrea,All Items About Eritrea,Tue Jun 30 2020 10:37:26 GMT+0700 (Indochina Time)
130963144784,12,American Samoa Polynesian Pattern Umbrella Collection,American Samoa Polynesian Pattern Umbrella Collection,Tue May 14 2019 16:36:26 GMT+0700 (Indochina Time)
161600766032,12,Bahrain Football Collection,Bahrain Football Collection,Tue Apr 21 2020 19:41:45 GMT+0700 (Indochina Time)
163137978448,12,Cameroon Lion Collection,Cameroon Lion Collection,Sat May 09 2020 14:34:54 GMT+0700 (Indochina Time)
133495783504,12,Canada Blur Style Collection,Canada Blur Style Collection,Mon Jun 24 2019 15:38:28 GMT+0700 (Indochina Time)
159527239760,12,Canadian Jewelry Collection,Canadian Jewelry Collection,Wed Feb 19 2020 14:48:57 GMT+0700 (Indochina Time)
159772377168,12,Celtic Jewelry Collection,Celtic Jewelry Collection,Tue Mar 03 2020 16:28:11 GMT+0700 (Indochina Time)
161392230480,12,Celtic Neck Gaiter Collection,Celtic Neck Gaiter Collection,Sat Apr 18 2020 09:22:04 GMT+0700 (Indochina Time)
160057098320,12,Celtic Woodland Dragon and The Green Man Collection,Celtic Woodland Dragon and The Green Man Collection,Mon Mar 16 2020 08:43:47 GMT+0700 (Indochina Time)
156438888528,12,Cook Islands Turtle Hibiscus Collections,Cook Islands Turtle Hibiscus Collections,Wed Nov 20 2019 15:32:56 GMT+0700 (Indochina Time)
166183993424,12,Cricket Australia,Cricket Australia,Mon Jul 20 2020 13:51:37 GMT+0700 (Indochina Time)
160292798544,12,Croatia Proud Version Collection,Croatia Proud Version Collection,Sat Mar 28 2020 17:02:42 GMT+0700 (Indochina Time)
159982682192,12,Dominican Republic Hoodies - Patriot Collection,Dominican Republic Hoodies - Patriot Collection,Thu Mar 12 2020 11:09:39 GMT+0700 (Indochina Time)
161114390608,12,Dominican Republic Spirit Collection,Dominican Republic Spirit Collection,Wed Apr 15 2020 07:51:56 GMT+0700 (Indochina Time)
160270319696,12,El Salvadorian Spirit Collection,El Salvadorian Spirit Collection,Fri Mar 27 2020 19:49:46 GMT+0700 (Indochina Time)
160015122512,12,Ethiopia Rasta Lion,Ethiopia Rasta Lion,Sat Mar 14 2020 12:49:29 GMT+0700 (Indochina Time)
156580118608,12,Finland Original Flag Collection,Finland Original Flag Collection,Fri Nov 22 2019 09:04:21 GMT+0700 (Indochina Time)
157484777552,12,Finland Rising Collection,Finland Rising Collection,Wed Dec 04 2019 17:27:11 GMT+0700 (Indochina Time)
165872959568,12,France ART Nouveau Collections,France ART Nouveau Collections,Fri Jul 10 2020 13:08:52 GMT+0700 (Indochina Time)
158223925328,12,Germany German Maple Leaf Collection,Germany German Maple Leaf Collection,Fri Dec 27 2019 16:13:10 GMT+0700 (Indochina Time)
159153782864,12,Germany Spirit,Germany Spirit,Fri Feb 07 2020 13:19:20 GMT+0700 (Indochina Time)
160429539408,12,Grenada Coat Of Arms and Flag Color,Grenada Coat Of Arms and Flag Color,Thu Apr 02 2020 21:05:07 GMT+0700 (Indochina Time)
160151994448,12,Guatemala Spirit Collection,Guatemala Spirit Collection,Fri Mar 20 2020 18:56:22 GMT+0700 (Indochina Time)
83829620805,12,HALLOWEEN & CHRISTMAS MOON LAMP,HALLOWEEN & CHRISTMAS MOON LAMP,Thu Oct 18 2018 23:18:50 GMT+0700 (Indochina Time)
157880909904,12,Hawaii Polynesia Turtle Collection,Hawaii Polynesia Turtle Collection,Fri Dec 13 2019 20:01:49 GMT+0700 (Indochina Time)
159685541968,12,Icelandic Spirit Collection,Icelandic Spirit Collection,Thu Feb 27 2020 10:00:03 GMT+0700 (Indochina Time)
161393410128,12,Inca Empire Neck Gaiter Collection,Inca Empire Neck Gaiter Collection,Sat Apr 18 2020 09:22:32 GMT+0700 (Indochina Time)
158956159056,12,Ireland - Irish Hurling Collection,Ireland - Irish Hurling Collection,Wed Jan 29 2020 16:40:02 GMT+0700 (Indochina Time)
163546300496,12,Ireland Cricket Team Collection,Ireland Cricket Team Collection,Thu May 14 2020 11:45:48 GMT+0700 (Indochina Time)
134110281808,12,Italy Aslant Blue Version,Italy Aslant Blue Version,Wed Jul 03 2019 10:40:38 GMT+0700 (Indochina Time)
133743673424,12,Italy Aslant Version Collection,Italy Aslant Version Collection,Fri Jun 28 2019 13:11:00 GMT+0700 (Indochina Time)
160182927440,12,Jamaica Coat Of Arms and Lion,Jamaica Coat Of Arms and Lion,Mon Mar 23 2020 08:14:51 GMT+0700 (Indochina Time)
165565694032,12,Jamaica Round Coat Of Arms Lion Collection,Jamaica Round Coat Of Arms Lion Collection,Tue Jun 30 2020 16:01:04 GMT+0700 (Indochina Time)
159876153424,12,Jatibonicua Flag Collection,Jatibonicua Flag Collection,Fri Mar 06 2020 16:28:02 GMT+0700 (Indochina Time)
159684984912,12,Kanaka Maoli (Hawaii) Hibiscus Turtle Tattoo Blue Collection,Kanaka Maoli (Hawaii) Hibiscus Turtle Tattoo Blue Collection,Thu Feb 27 2020 09:17:14 GMT+0700 (Indochina Time)
159684919376,12,Kanaka Maoli (Hawaii) Hibiscus Turtle Tattoo Gray Collection,Kanaka Maoli (Hawaii) Hibiscus Turtle Tattoo Gray Collection,Thu Feb 27 2020 09:07:17 GMT+0700 (Indochina Time)
161684979792,12,Kanaka Maoli (Hawaiian) - Grocery Bag Turtle Tropical Flower Collection,Kanaka Maoli (Hawaiian) - Grocery Bag Turtle Tropical Flower Collection,Wed Apr 22 2020 20:33:50 GMT+0700 (Indochina Time)
161121206352,12,Kanaka Moli Hawaiian Polynesian Hibiscus Collection,Kanaka Moli Hawaiian Polynesian Hibiscus Collection,Wed Apr 15 2020 10:47:48 GMT+0700 (Indochina Time)
165110186064,12,Kenya Kente Pattern Kenya Map Collection,Kenya Kente Pattern Kenya Map Collection,Mon Jun 15 2020 17:38:52 GMT+0700 (Indochina Time)
159969837136,12,Kenya Patterns And Coat Of Arms Collection,Kenya Patterns And Coat Of Arms Collection,Wed Mar 11 2020 16:54:22 GMT+0700 (Indochina Time)
160144818256,12,Lithuania Coat Of Arms with Flag Color,Lithuania Coat Of Arms with Flag Color,Fri Mar 20 2020 08:14:24 GMT+0700 (Indochina Time)
165842190416,12,Livepool F.C Collection,Livepool F.C Collection,Thu Jul 09 2020 08:11:51 GMT+0700 (Indochina Time)
160514375760,12,Maltese Cross With Flag Color,Maltese Cross With Flag Color,Sat Apr 04 2020 13:39:06 GMT+0700 (Indochina Time)
165817516112,12,Mandala Hawaii Shirt Collection,Mandala Hawaii Shirt Collection,Wed Jul 08 2020 10:33:41 GMT+0700 (Indochina Time)
130140536912,12,Marshall Islands Coconut Tree Collection,Marshall Islands Coconut Tree Collection,Sat Apr 27 2019 21:00:27 GMT+0700 (Indochina Time)
153563791440,12,Mauritania Active Collection,Mauritania Active Collection,Thu Oct 24 2019 11:07:17 GMT+0700 (Indochina Time)
165210095696,12,Melanesian Plumeria Banana Leaves Reggae Collection,Melanesian Plumeria Banana Leaves Reggae Collection,Fri Jun 19 2020 08:28:19 GMT+0700 (Indochina Time)
159949979728,12,Mexico Spirit (Aztec) Collection,Mexico Spirit (Aztec) Collection,Tue Mar 10 2020 15:25:53 GMT+0700 (Indochina Time)
165347164240,12,Native American Girls With Dreamcatcher Collection,Native American Girls With Dreamcatcher Collection,Thu Jun 25 2020 16:45:49 GMT+0700 (Indochina Time)
166180716624,12,Netherlands Sporty Style Collection,Netherlands Sporty Style Collection,Mon Jul 20 2020 08:46:01 GMT+0700 (Indochina Time)
98941894736,12,New Zealand Maori Traditional Colors Collection,New Zealand Maori Traditional Colors Collection,Wed Feb 27 2019 13:36:51 GMT+0700 (Indochina Time)
148618707024,12,NEW ZEALAND RUGBY WARRIOR A11,NEW ZEALAND RUGBY WARRIOR A11,Tue Sep 24 2019 17:12:07 GMT+0700 (Indochina Time)
156670525520,12,Niue Golden Coconut Collection,Niue Golden Coconut Collection,Sat Nov 23 2019 16:34:39 GMT+0700 (Indochina Time)
57634488389,12,"Norway luggage cover- Best selling collection| LoveNorway| 1sttheworld","Norway luggage cover- Best selling collection| LoveNorway| 1sttheworld",Mon Jul 30 2018 10:34:35 GMT+0700 (Indochina Time)
163454419024,12,Ottoman Empire Warrior Collection,Ottoman Empire Warrior Collection,Wed May 13 2020 08:59:04 GMT+0700 (Indochina Time)
166536839248,12,Pan-African Roots Of Humanity Collection,Pan-African Roots Of Humanity Collection,Thu Jul 23 2020 15:37:48 GMT+0700 (Indochina Time)
166843646032,12,Papua New Guinea Clothing Collection,Papua New Guinea Clothing Collection,Fri Jul 24 2020 21:13:42 GMT+0700 (Indochina Time)
164663525456,12,Papua New Guinea Hometown,Papua New Guinea Hometown,Tue Jun 02 2020 13:14:25 GMT+0700 (Indochina Time)
159724240976,12,Poland Folk Patterns Collection,Poland Folk Patterns Collection,Sat Feb 29 2020 09:36:27 GMT+0700 (Indochina Time)
159875825744,12,Polynesian Collection,Polynesian Collection,Fri Mar 06 2020 15:54:32 GMT+0700 (Indochina Time)
162138128464,12,Polynesian Puzzle Collection,Polynesian Puzzle Collection,Tue Apr 28 2020 15:18:25 GMT+0700 (Indochina Time)
166985695312,13,Kiribati Bedding Set - Polynesian Turtle Coconut Tree And Plumeria,Kiribati Bedding Set - Polynesian Turtle Coconut Tree And Plumeria,Wed Jul 29 2020 15:48:40 GMT+0700 (Indochina Time)
166987038800,13,Niue Bedding Set - Polynesian Turtle Coconut Tree And Plumeria,Niue Bedding Set - Polynesian Turtle Coconut Tree And Plumeria,Wed Jul 29 2020 16:31:18 GMT+0700 (Indochina Time)
166536904784,13,Africa Pan-African Flag and Map,Africa Pan-African Flag and Map,Thu Jul 23 2020 15:48:00 GMT+0700 (Indochina Time)
159101091920,13,African Root Africa Collection,African Root Africa Collection,Thu Feb 06 2020 09:30:05 GMT+0700 (Indochina Time)
130659909712,13,All Items About Kenya,All Items About Kenya,Wed May 08 2019 13:25:38 GMT+0700 (Indochina Time)
165448319056,13,All Items About Vanuatu,All Items About Vanuatu,Fri Jun 26 2020 13:17:24 GMT+0700 (Indochina Time)
166984777808,13,American Samoa Bedding Set - Polynesian Turtle Coconut Tree And Plumeria Collection,American Samoa Bedding Set - Polynesian Turtle Coconut Tree And Plumeria Collection,Wed Jul 29 2020 15:01:14 GMT+0700 (Indochina Time)
164048011344,13,Argentina Special Flag Collection,Argentina Special Flag Collection,Wed May 20 2020 14:15:26 GMT+0700 (Indochina Time)
161571471440,13,Australia Mouth Mask Collection,Australia Mouth Mask Collection,Tue Apr 21 2020 10:07:46 GMT+0700 (Indochina Time)
159432179792,13,Austria Spirit,Austria Spirit,Mon Feb 17 2020 16:32:21 GMT+0700 (Indochina Time)
163622551632,13,Bermuda Special Collection,Bermuda Special Collection,Fri May 15 2020 09:10:54 GMT+0700 (Indochina Time)
166307004496,13,Burkina Special Flag Collection,Burkina Special Flag Collection,Wed Jul 22 2020 10:48:22 GMT+0700 (Indochina Time)
166985367632,13,Chuuk Bedding Set - Polynesian Turtle Coconut Tree And Plumeria collection,Chuuk Bedding Set - Polynesian Turtle Coconut Tree And Plumeria collection,Wed Jul 29 2020 15:29:23 GMT+0700 (Indochina Time)
157592322128,13,Chuuk Kanaloa Tatau Gen FM Collection,Chuuk Kanaloa Tatau Gen FM Collection,Thu Dec 05 2019 21:51:54 GMT+0700 (Indochina Time)
166985531472,13,Cook Isalnd Bedding Set - Polynesian Turtle Coconut Tree And Plumeria Collection,Cook Isalnd Bedding Set - Polynesian Turtle Coconut Tree And Plumeria Collection,Wed Jul 29 2020 15:37:52 GMT+0700 (Indochina Time)
162971713616,13,EARRINGS,EARRINGS,Thu May 07 2020 15:59:53 GMT+0700 (Indochina Time)
164359110736,13,Eritrean - Nipsey Hussle Art Collection,Eritrean - Nipsey Hussle Art Collection,Mon May 25 2020 09:35:58 GMT+0700 (Indochina Time)
166985597008,13,Guam Bedding Set - Polynesian Turtle Coconut Tree And Plumeria collection,Guam Bedding Set - Polynesian Turtle Coconut Tree And Plumeria collection,Wed Jul 29 2020 15:41:49 GMT+0700 (Indochina Time)
135554007120,13,Guam Hibiscus Collection,Guam Hibiscus Collection,Thu Jul 25 2019 11:11:18 GMT+0700 (Indochina Time)
159898042448,13,Guyana Coat Of Arms and Jaguar Patterns,Guyana Coat Of Arms and Jaguar Patterns,Sat Mar 07 2020 09:20:33 GMT+0700 (Indochina Time)
159900926032,13,Ireland Jewelry Collection,Ireland Jewelry Collection,Sat Mar 07 2020 09:56:04 GMT+0700 (Indochina Time)
155350794320,13,Israel Rising Collection,Israel Rising Collection,Wed Nov 06 2019 15:47:55 GMT+0700 (Indochina Time)
150915940432,13,Kiribati Hometown Collection,Kiribati Hometown Collection,Sat Sep 28 2019 14:18:08 GMT+0700 (Indochina Time)
166985793616,13,Kosrae Bedding Set - Polynesian Turtle Coconut Tree And Plumeria Collection,Kosrae Bedding Set - Polynesian Turtle Coconut Tree And Plumeria Collection,Wed Jul 29 2020 16:00:27 GMT+0700 (Indochina Time)
165235654736,13,Lithuania Vytis Columns of Gediminas Collection,Lithuania Vytis Columns of Gediminas Collection,Sat Jun 20 2020 10:19:04 GMT+0700 (Indochina Time)
156650143824,13,Lithuanian Iron Wolf Collection,Lithuanian Iron Wolf Collection,Sat Nov 23 2019 10:16:08 GMT+0700 (Indochina Time)
159001477200,13,Lithuanian Tattoo Collection,Lithuanian Tattoo Collection,Sat Feb 01 2020 16:28:11 GMT+0700 (Indochina Time)
153345228880,13,Love Australia - Vintage Style Collection,Love Australia - Vintage Style Collection,Tue Oct 22 2019 10:58:46 GMT+0700 (Indochina Time)
160599212112,13,Marshall Islands - HOME Collection,Marshall Islands - HOME Collection,Mon Apr 06 2020 13:34:17 GMT+0700 (Indochina Time)
166986711120,13,Marshall Islands Bedding Set - Polynesian Turtle Coconut Tree And Plumeria,Marshall Islands Bedding Set - Polynesian Turtle Coconut Tree And Plumeria,Wed Jul 29 2020 16:18:55 GMT+0700 (Indochina Time)
165595086928,13,Native American Collection - Dreamcatcher Blue Color Style,Native American Collection - Dreamcatcher Blue Color Style,Wed Jul 01 2020 14:45:22 GMT+0700 (Indochina Time)
166986809424,13,Nauru Bedding Set - Polynesian Turtle Coconut Tree And Plumeria,Nauru Bedding Set - Polynesian Turtle Coconut Tree And Plumeria,Wed Jul 29 2020 16:21:30 GMT+0700 (Indochina Time)
164862689360,13,Nauru Calophyllum Collection,Nauru Calophyllum Collection,Tue Jun 09 2020 19:47:51 GMT+0700 (Indochina Time)
159723487312,13,Netherlands Coat Of Arms,Netherlands Coat Of Arms,Sat Feb 29 2020 07:51:56 GMT+0700 (Indochina Time)
165132763216,13,Niue Hometown Collection,Niue Hometown Collection,Tue Jun 16 2020 13:19:10 GMT+0700 (Indochina Time)
166987104336,13,Northern Mariana Islands Bedding Set - Polynesian Turtle Coconut Tree And Plumeria,Northern Mariana Islands Bedding Set - Polynesian Turtle Coconut Tree And Plumeria,Wed Jul 29 2020 16:44:38 GMT+0700 (Indochina Time)
160713637968,13,Obey The Corgi Collection,Obey The Corgi Collection,Wed Apr 08 2020 14:25:32 GMT+0700 (Indochina Time)
163373973584,13,Palau - HOME Collection,Palau - HOME Collection,Tue May 12 2020 09:22:17 GMT+0700 (Indochina Time)
166987235408,13,Palau Bedding Set - Polynesian Turtle Coconut Tree And Plumeria,Palau Bedding Set - Polynesian Turtle Coconut Tree And Plumeria,Wed Jul 29 2020 16:49:51 GMT+0700 (Indochina Time)
166987268176,13,Papua New Guinea Bedding Set - Polynesian Turtle Coconut Tree And Plumeria,Papua New Guinea Bedding Set - Polynesian Turtle Coconut Tree And Plumeria,Wed Jul 29 2020 16:51:36 GMT+0700 (Indochina Time)
166987333712,13,Pohnpei Bedding Set - Polynesian Turtle Coconut Tree And Plumeria,Pohnpei Bedding Set - Polynesian Turtle Coconut Tree And Plumeria,Wed Jul 29 2020 16:54:00 GMT+0700 (Indochina Time)
161056555088,13,Polynesian Neck Gaiter,Polynesian Neck Gaiter,Tue Apr 14 2020 11:45:15 GMT+0700 (Indochina Time)
99016605776,13,Polynesian Tattoo Style Summer Collection,Polynesian Tattoo Style Summer Collection,Thu Feb 28 2019 22:41:36 GMT+0700 (Indochina Time)
161660502096,14,American Samoa Face Mask Collection,American Samoa Face Mask Collection,Wed Apr 22 2020 15:03:53 GMT+0700 (Indochina Time)
159906168912,14,AMERICAN SAMOA TUMBLER POLYNESIAN LIMITED VERSION,AMERICAN SAMOA TUMBLER POLYNESIAN LIMITED VERSION,Sat Mar 07 2020 13:33:10 GMT+0700 (Indochina Time)
165130305616,14,Australia Indigenous Naidoc Week Polo Shirts Collection,Australia Indigenous Naidoc Week Polo Shirts Collection,Tue Jun 16 2020 11:35:02 GMT+0700 (Indochina Time)
165129289808,14,Australia Indigenous Naidoc Week T-Shirt Collection,Australia Indigenous Naidoc Week T-Shirt Collection,Tue Jun 16 2020 10:45:41 GMT+0700 (Indochina Time)
163770794064,14,Azerbaijan Special Flag Collection,Azerbaijan Special Flag Collection,Sun May 17 2020 10:42:49 GMT+0700 (Indochina Time)
161992704080,14,Bernese Dog Puzzle,Bernese Dog Puzzle,Mon Apr 27 2020 09:43:37 GMT+0700 (Indochina Time)
167051788368,14,Brisbane Broncos Special Collection,Brisbane Broncos Special Collection,Sat Aug 01 2020 08:37:51 GMT+0700 (Indochina Time)
79531900997,14,Buchanan Tartan Socks Collections,Buchanan Tartan Socks Collections,Wed Sep 26 2018 10:17:12 GMT+0700 (Indochina Time)
153561137232,14,Celtic Tree of life Yggdrasil Collection,Celtic Tree of life Yggdrasil Collection,Thu Oct 24 2019 09:05:52 GMT+0700 (Indochina Time)
162729132112,14,Cook Islands A Love a Little Paradise,Cook Islands A Love a Little Paradise,Mon May 04 2020 10:45:02 GMT+0700 (Indochina Time)
159905677392,14,COOK ISLANDS TUMBLER POLYNESIAN LIMITED VERSION,COOK ISLANDS TUMBLER POLYNESIAN LIMITED VERSION,Sat Mar 07 2020 10:38:46 GMT+0700 (Indochina Time)
162191507536,14,Croatia Home Collection,Croatia Home Collection,Tue Apr 28 2020 22:33:41 GMT+0700 (Indochina Time)
158768660560,14,Delta Sigma Theta Hoodie Collection,Delta Sigma Theta Hoodie Collection,Sat Jan 18 2020 13:37:32 GMT+0700 (Indochina Time)
166985236560,14,Fiji Bedding Set - Polynesian Turtle Coconut Tree And Plumeria Collection,Fiji Bedding Set - Polynesian Turtle Coconut Tree And Plumeria Collection,Wed Jul 29 2020 15:24:02 GMT+0700 (Indochina Time)
165213700176,14,Fiji Drua Tapa Collection,Fiji Drua Tapa Collection,Fri Jun 19 2020 11:51:45 GMT+0700 (Indochina Time)
161502429264,14,Fiji Respirator Mask Collection,Fiji Respirator Mask Collection,Mon Apr 20 2020 09:51:27 GMT+0700 (Indochina Time)
159906955344,14,FIJI TUMBLER POLYNESIAN LIMITED VERSION,FIJI TUMBLER POLYNESIAN LIMITED VERSION,Sat Mar 07 2020 16:01:48 GMT+0700 (Indochina Time)
156670132304,14,Guam Golden Coconut Collection,Guam Golden Coconut Collection,Sat Nov 23 2019 16:15:20 GMT+0700 (Indochina Time)
160165888080,14,Hawaii - Kanaka Maoli Collection,Hawaii - Kanaka Maoli Collection,Sat Mar 21 2020 16:37:07 GMT+0700 (Indochina Time)
166159155280,14,Hawaii Polynesian Turtle Hibiscus Blue Collection,Hawaii Polynesian Turtle Hibiscus Blue Collection,Sat Jul 18 2020 10:03:30 GMT+0700 (Indochina Time)
159811895376,14,Hieroglyphs Collection,Hieroglyphs Collection,Thu Mar 05 2020 16:46:13 GMT+0700 (Indochina Time)
162260353104,14,Iceland Puzzle World,Iceland Puzzle World,Wed Apr 29 2020 10:04:43 GMT+0700 (Indochina Time)
159935529040,14,Insulated Tumblers - Chuuk,Insulated Tumblers - Chuuk,Mon Mar 09 2020 14:52:31 GMT+0700 (Indochina Time)
159935561808,14,Insulated Tumblers - Papua New Guinea,Insulated Tumblers - Papua New Guinea,Mon Mar 09 2020 14:52:31 GMT+0700 (Indochina Time)
159935791184,14,Insulated Tumblers - Tonga,Insulated Tumblers - Tonga,Mon Mar 09 2020 14:52:31 GMT+0700 (Indochina Time)
159935889488,14,Insulated Tumblers - Vanuatu,Insulated Tumblers - Vanuatu,Mon Mar 09 2020 14:52:31 GMT+0700 (Indochina Time)
