collection_id,product,title,link,published_at
88436539461,0,Aboriginal Kangaroo Uluru Collection,Aboriginal Kangaroo Uluru Collection,Thu Nov 15 2018 07:53:23 GMT+0700 (Indochina Time)
161006026832,0,Canada Neck Gaiter Flag Collection,Canada Neck Gaiter Flag Collection,Mon Apr 13 2020 18:00:31 GMT+0700 (Indochina Time)
165816991824,0,Confederate Collection,Confederate Collection,Wed Jul 08 2020 09:45:17 GMT+0700 (Indochina Time)
159913082960,0,Custom George Washington Clothing,Custom George Washington Clothing,Sat Mar 07 2020 23:55:34 GMT+0700 (Indochina Time)
156352872528,0,Fergusson,Fergusson,Tue Nov 19 2019 14:54:19 GMT+0700 (Indochina Time)
165946163280,0,George Washington Collection,George Washington Collection,Tue Jul 14 2020 14:29:51 GMT+0700 (Indochina Time)
166288719952,0,Hightop Canvas Shoe,Hightop Canvas Shoe,Tue Jul 21 2020 16:57:26 GMT+0700 (Indochina Time)
163835379792,0,Jordan Special Flag Collection,Jordan Special Flag Collection,Mon May 18 2020 13:37:25 GMT+0700 (Indochina Time)
99288449104,0,MEN'S BASEBALL JERSEY SHIRTS,MEN'S BASEBALL JERSEY SHIRTS,Wed Mar 06 2019 14:05:07 GMT+0700 (Indochina Time)
165343526992,0,Micronesia Rugby,Micronesia Rugby,Thu Jun 25 2020 10:57:11 GMT+0700 (Indochina Time)
91967782981,0,Polynesian Quilt Blankets,Polynesian Quilt Blankets,Wed Feb 13 2019 22:07:33 GMT+0700 (Indochina Time)
163624648784,1,aaa,aaa,Fri May 15 2020 10:06:31 GMT+0700 (Indochina Time)
164048502864,1,Argentina Sneakers Wings Flag (Women's/Men's) A7,Argentina Sneakers Wings Flag (Women's/Men's) A7,Wed May 20 2020 14:24:10 GMT+0700 (Indochina Time)
4237492235,1,gordon modern flag,gordon modern flag,Mon Jan 29 2018 16:58:34 GMT+0700 (Indochina Time)
164730110032,2,Africa Animal Sport Mask Collection,Africa Animal Sport Mask Collection,Thu Jun 04 2020 16:18:11 GMT+0700 (Indochina Time)
165873778768,2,Australia Sneakers Forever,Australia Sneakers Forever,Fri Jul 10 2020 13:54:12 GMT+0700 (Indochina Time)
161013530704,2,Dominican Republic Mouth Mask Collection,Dominican Republic Mouth Mask Collection,Mon Apr 13 2020 17:07:44 GMT+0700 (Indochina Time)
165187256400,2,New Zealand Maori Pattern Hoodie - Circle Style J1,New Zealand Maori Pattern Hoodie - Circle Style J1,Thu Jun 18 2020 10:24:39 GMT+0700 (Indochina Time)
167127449680,2,Postcard Message Premium Blanket Collection,Postcard Message Premium Blanket Collection,Wed Aug 05 2020 10:16:08 GMT+0700 (Indochina Time)
167106642000,3,Kanaka Maoli (Hawaiian) Polynesian Waves Turtle Coconut Tree And Hibiscus Collection,Kanaka Maoli (Hawaiian) Polynesian Waves Turtle Coconut Tree And Hibiscus Collection,Tue Aug 04 2020 18:23:27 GMT+0700 (Indochina Time)
160237092944,3,23232,23232,Thu Mar 26 2020 10:54:02 GMT+0700 (Indochina Time)
164941791312,3,Australia: We Stand with you! Collection,Australia: We Stand with you! Collection,Fri Jun 12 2020 22:22:25 GMT+0700 (Indochina Time)
160060080208,3,Catalunya - Catalonia Sneakers Collection,Catalunya - Catalonia Sneakers Collection,Mon Mar 16 2020 14:37:03 GMT+0700 (Indochina Time)
167013777488,3,Eritrea Bandana Collection,Eritrea Bandana Collection,Thu Jul 30 2020 10:37:03 GMT+0700 (Indochina Time)
160127844432,3,Germany products for Tuan Tran Customer,Germany products for Tuan Tran Customer,Thu Mar 19 2020 15:46:08 GMT+0700 (Indochina Time)
161012383824,3,Ghana Mouth Mask Collection,Ghana Mouth Mask Collection,Mon Apr 13 2020 17:07:44 GMT+0700 (Indochina Time)
160261570640,3,Hippie Purple Collection,Hippie Purple Collection,Fri Mar 27 2020 10:46:38 GMT+0700 (Indochina Time)
161010581584,3,Jamaica Mouth Mask Collection,Jamaica Mouth Mask Collection,Mon Apr 13 2020 20:45:20 GMT+0700 (Indochina Time)
166008914000,3,Kanaka Maoli (Hawaiian) Polynesian Plumeria Tattoo,Kanaka Maoli (Hawaiian) Polynesian Plumeria Tattoo,Thu Jul 16 2020 11:52:42 GMT+0700 (Indochina Time)
165346410576,3,Native American Fox Dreamcatcher Collection,Native American Fox Dreamcatcher Collection,Thu Jun 25 2020 14:58:23 GMT+0700 (Indochina Time)
160185057360,4,(Custom) Polynesian Leggings Rising Personal Signature Collection,(Custom) Polynesian Leggings Rising Personal Signature Collection,Mon Mar 23 2020 10:37:16 GMT+0700 (Indochina Time)
160520175696,4,(Custom) South Africa Nelson Mandela Flag,(Custom) South Africa Nelson Mandela Flag,Sat Apr 04 2020 17:44:01 GMT+0700 (Indochina Time)
160264388688,4,(Custom) Switzerland Landscape Collection,(Custom) Switzerland Landscape Collection,Fri Mar 27 2020 14:03:11 GMT+0700 (Indochina Time)
162971648080,4,(Custom) The Netherlands Silver Flag Tulip Personal Signature,(Custom) The Netherlands Silver Flag Tulip Personal Signature,Thu May 07 2020 15:55:49 GMT+0700 (Indochina Time)
162972958800,4,(Custom) Wales Silver Daffodil Personal Signature,(Custom) Wales Silver Daffodil Personal Signature,Thu May 07 2020 16:37:38 GMT+0700 (Indochina Time)
166765690960,4,African I Wanna Be A Lion,African I Wanna Be A Lion,Fri Jul 24 2020 14:09:14 GMT+0700 (Indochina Time)
159809110096,4,Albania - Albania Flag Collection,Albania - Albania Flag Collection,Thu Mar 05 2020 11:38:37 GMT+0700 (Indochina Time)
161742880848,4,Albania Football Collection,Albania Football Collection,Thu Apr 23 2020 18:40:52 GMT+0700 (Indochina Time)
160650428496,4,All Items About American Samoa,All Items About American Samoa,Tue Apr 07 2020 11:29:22 GMT+0700 (Indochina Time)
160293355600,4,All Items About Liechtenstein,All Items About Liechtenstein,Sat Mar 28 2020 17:26:08 GMT+0700 (Indochina Time)
166923108432,4,All Items About Marquesas Islands,All Items About Marquesas Islands,Mon Jul 27 2020 09:32:15 GMT+0700 (Indochina Time)
160057786448,4,ALL TARTAN,ALL TARTAN,Mon Mar 16 2020 10:17:10 GMT+0700 (Indochina Time)
165688442960,4,American Samoa Polynesian Collection,American Samoa Polynesian Collection,Fri Jul 03 2020 14:44:32 GMT+0700 (Indochina Time)
159861047376,4,Aruba - Aruba Flag Collection,Aruba - Aruba Flag Collection,Fri Mar 06 2020 09:20:48 GMT+0700 (Indochina Time)
166185107536,4,Australia Aboriginal Bedding Set Collection,Australia Aboriginal Bedding Set Collection,Mon Jul 20 2020 15:27:53 GMT+0700 (Indochina Time)
159355699280,4,Australia Anzac Day and The Ode,Australia Anzac Day and The Ode,Sat Feb 15 2020 09:04:03 GMT+0700 (Indochina Time)
159947685968,4,Australia Clothing - Ball Style,Australia Clothing - Ball Style,Tue Mar 10 2020 09:36:22 GMT+0700 (Indochina Time)
164385128528,4,Australia Queensland Reds Collection,Australia Queensland Reds Collection,Mon May 25 2020 15:58:03 GMT+0700 (Indochina Time)
160350666832,4,Austrian Empire Collection,Austrian Empire Collection,Tue Mar 31 2020 13:26:11 GMT+0700 (Indochina Time)
165986631760,4,Bahamas Marlin Coat Of Arms Collection,Bahamas Marlin Coat Of Arms Collection,Wed Jul 15 2020 17:38:32 GMT+0700 (Indochina Time)
165871976528,4,Barbados Coat Of Arms Collection,Barbados Coat Of Arms Collection,Fri Jul 10 2020 11:27:32 GMT+0700 (Indochina Time)
161069269072,4,Belize Mouth Mask Collection,Belize Mouth Mask Collection,Tue Apr 14 2020 16:16:33 GMT+0700 (Indochina Time)
166313590864,4,British Columbia Collection,British Columbia Collection,Wed Jul 22 2020 18:58:55 GMT+0700 (Indochina Time)
165948391504,4,Cabo Verde,Cabo Verde,Tue Jul 14 2020 16:41:46 GMT+0700 (Indochina Time)
164051714128,4,Croatia Spirit Of A Nation Collections,Croatia Spirit Of A Nation Collections,Wed May 20 2020 15:33:17 GMT+0700 (Indochina Time)
157590650960,4,Custom Tahiti Special Clothing,Custom Tahiti Special Clothing,Thu Dec 05 2019 21:22:45 GMT+0700 (Indochina Time)
158414143568,4,Custom United States Football - Football Ohio States,Custom United States Football - Football Ohio States,Sat Jan 04 2020 18:34:34 GMT+0700 (Indochina Time)
164698062928,4,Egypt Clothings Collections,Egypt Clothings Collections,Wed Jun 03 2020 14:52:03 GMT+0700 (Indochina Time)
166460653648,4,Egyptian Bird And Flag Collection,Egyptian Bird And Flag Collection,Thu Jul 23 2020 08:46:40 GMT+0700 (Indochina Time)
158740906064,4,Estonia Couple Car Seat Cover Collection,Estonia Couple Car Seat Cover Collection,Fri Jan 17 2020 11:07:20 GMT+0700 (Indochina Time)
165295325264,4,Ethiopia Lion Of Judah Flag Collection,Ethiopia Lion Of Judah Flag Collection,Tue Jun 23 2020 16:48:57 GMT+0700 (Indochina Time)
160912900176,4,Fiji Mouth Mask Collection,Fiji Mouth Mask Collection,Sat Apr 11 2020 18:29:38 GMT+0700 (Indochina Time)
157336338512,4,Finland Karhu Collection,Finland Karhu Collection,Mon Dec 02 2019 22:33:36 GMT+0700 (Indochina Time)
159358058576,4,Greece Spartan Warrior Helmet Vintage Ethnic Seamless,Greece Spartan Warrior Helmet Vintage Ethnic Seamless,Sat Feb 15 2020 11:59:32 GMT+0700 (Indochina Time)
166883164240,4,Guam Lauhala Polynesian Collection,Guam Lauhala Polynesian Collection,Sat Jul 25 2020 16:32:04 GMT+0700 (Indochina Time)
163129327696,4,Guam Polynesian Pacific Tribal,Guam Polynesian Pacific Tribal,Sat May 09 2020 09:51:41 GMT+0700 (Indochina Time)
159525568592,4,Haiti Coat of Arms Hibiscus Plumeria Light Brown,Haiti Coat of Arms Hibiscus Plumeria Light Brown,Wed Feb 19 2020 11:28:53 GMT+0700 (Indochina Time)
159525601360,4,Haiti Coat of Arms Hibiscus Plumeria Red,Haiti Coat of Arms Hibiscus Plumeria Red,Wed Feb 19 2020 11:40:58 GMT+0700 (Indochina Time)
158239227984,4,Haiti Home Collection,Haiti Home Collection,Sat Dec 28 2019 13:48:04 GMT+0700 (Indochina Time)
157478584400,4,HAITI NEG MARON,HAITI NEG MARON,Wed Dec 04 2019 15:32:15 GMT+0700 (Indochina Time)
166931464272,4,Hawaii Banana Leaves Custom,Hawaii Banana Leaves Custom,Mon Jul 27 2020 18:18:26 GMT+0700 (Indochina Time)
160064372816,4,Hawaii Leggings - Polynesian Hibiscus Collection,Hawaii Leggings - Polynesian Hibiscus Collection,Mon Mar 16 2020 20:29:36 GMT+0700 (Indochina Time)
163129426000,4,Hawaii Polynesian Pacific Tribal,Hawaii Polynesian Pacific Tribal,Sat May 09 2020 09:53:30 GMT+0700 (Indochina Time)
157551394896,4,Hawaii Turtle Tribal Home Set,Hawaii Turtle Tribal Home Set,Thu Dec 05 2019 09:14:49 GMT+0700 (Indochina Time)
160289456208,4,Healthy At Home Collection,Healthy At Home Collection,Sat Mar 28 2020 11:06:39 GMT+0700 (Indochina Time)
159749865552,4,HUNGARY VERSION FLAG,HUNGARY VERSION FLAG,Mon Mar 02 2020 15:38:37 GMT+0700 (Indochina Time)
160288079952,4,Icelands Flag Wavy Lines Custom Collection,Icelands Flag Wavy Lines Custom Collection,Sat Mar 28 2020 08:26:50 GMT+0700 (Indochina Time)
159463178320,4,Ireland - Claddagh Shamrock Cross Celtic Collection White Collection,Ireland - Claddagh Shamrock Cross Celtic Collection White Collection,Tue Feb 18 2020 08:13:26 GMT+0700 (Indochina Time)
159046467664,4,IRELAND CELTIC SHAMROCK,IRELAND CELTIC SHAMROCK,Tue Feb 04 2020 09:06:18 GMT+0700 (Indochina Time)
160187514960,4,IRELAND GREEN SHAMROCK CELTIC MAP,IRELAND GREEN SHAMROCK CELTIC MAP,Mon Mar 23 2020 16:41:32 GMT+0700 (Indochina Time)
159242747984,4,Ireland Shamrock Celtic Knot Collection,Ireland Shamrock Celtic Knot Collection,Wed Feb 12 2020 15:38:38 GMT+0700 (Indochina Time)
160204882000,4,Ireland Shamrock Map Tick Hublin,Ireland Shamrock Map Tick Hublin,Tue Mar 24 2020 17:00:38 GMT+0700 (Indochina Time)
159001575504,4,Irish St Patrick's Day,Irish St Patrick's Day,Sat Feb 01 2020 16:53:55 GMT+0700 (Indochina Time)
165899665488,4,Jamaica Doctor Bird With Flower Collection,Jamaica Doctor Bird With Flower Collection,Sat Jul 11 2020 14:46:29 GMT+0700 (Indochina Time)
160062505040,4,Kanaka Maoli (Hawaiian) - Samoan - Polynesian Tribal Hibiscus,Kanaka Maoli (Hawaiian) - Samoan - Polynesian Tribal Hibiscus,Mon Mar 16 2020 18:05:19 GMT+0700 (Indochina Time)
165210194000,4,Kanaka( Hawaii) Coat Of Arms And Waves Collection,Kanaka( Hawaii) Coat Of Arms And Waves Collection,Fri Jun 19 2020 09:06:52 GMT+0700 (Indochina Time)
165347033168,4,Kenya Flag- A Dance Shield Patterns Collection,Kenya Flag- A Dance Shield Patterns Collection,Thu Jun 25 2020 16:15:09 GMT+0700 (Indochina Time)
159765364816,4,Knight of Malta - Knights Hospitaller,Knight of Malta - Knights Hospitaller,Tue Mar 03 2020 08:22:37 GMT+0700 (Indochina Time)
158484004944,4,Lebanon Lebanese Lion Collection,Lebanon Lebanese Lion Collection,Tue Jan 07 2020 11:06:17 GMT+0700 (Indochina Time)
159602933840,4,Lietuva Flag Armor,Lietuva Flag Armor,Sat Feb 22 2020 13:13:48 GMT+0700 (Indochina Time)
159357567056,4,Lithuania Flag Map Collection,Lithuania Flag Map Collection,Sat Feb 15 2020 11:52:32 GMT+0700 (Indochina Time)
159791251536,4,Lithuania Knight Collection,Lithuania Knight Collection,Wed Mar 04 2020 08:47:40 GMT+0700 (Indochina Time)
160356270160,4,Los Angeles Basketball Collection,Los Angeles Basketball Collection,Tue Mar 31 2020 19:26:15 GMT+0700 (Indochina Time)
156273934416,4,Macedonia Is In My DNA,Macedonia Is In My DNA,Mon Nov 18 2019 14:25:28 GMT+0700 (Indochina Time)
156027453520,4,Malta Coat Of Arms Clothing Collection,Malta Coat Of Arms Clothing Collection,Thu Nov 14 2019 23:24:07 GMT+0700 (Indochina Time)
163658268752,4,Marshall Island Polynesian with Hibiscus Collection,Marshall Island Polynesian with Hibiscus Collection,Fri May 15 2020 19:55:45 GMT+0700 (Indochina Time)
159687508048,4,Medieval Knight Apparel,Medieval Knight Apparel,Thu Feb 27 2020 13:29:26 GMT+0700 (Indochina Time)
33718141038,4,Mexican Baja Hippie Collection,Mexican Baja Hippie Collection,Sat Jul 21 2018 11:04:07 GMT+0700 (Indochina Time)
150914564176,4,Mexican Christmas Collection,Mexican Christmas Collection,Sat Sep 28 2019 13:33:28 GMT+0700 (Indochina Time)
166981140560,4,Mexico Tonatiuh Collection,Mexico Tonatiuh Collection,Wed Jul 29 2020 13:22:01 GMT+0700 (Indochina Time)
159294783568,4,Morocco Barbary Lion Geometric Trellis Pattern Flag,Morocco Barbary Lion Geometric Trellis Pattern Flag,Thu Feb 13 2020 15:58:57 GMT+0700 (Indochina Time)
165613437008,4,Native American 4 Wolves Collection,Native American 4 Wolves Collection,Thu Jul 02 2020 09:53:06 GMT+0700 (Indochina Time)
157752492112,4,NAURU WHITE EYES BIRD,NAURU WHITE EYES BIRD,Mon Dec 09 2019 17:19:09 GMT+0700 (Indochina Time)
159815172176,4,Nederland Lion Coat Of Arms Collection,Nederland Lion Coat Of Arms Collection,Thu Mar 05 2020 20:56:35 GMT+0700 (Indochina Time)
161058029648,4,Netherlands Mouth Mask Collection,Netherlands Mouth Mask Collection,Tue Apr 14 2020 11:11:40 GMT+0700 (Indochina Time)
159363072080,4,New Zealand Anzac Day and The Ode,New Zealand Anzac Day and The Ode,Sat Feb 15 2020 17:21:06 GMT+0700 (Indochina Time)
159343083600,4,New Zealand Anzac Day Lest We Forget Sliver Fern Poppies,New Zealand Anzac Day Lest We Forget Sliver Fern Poppies,Fri Feb 14 2020 18:07:15 GMT+0700 (Indochina Time)
159181373520,4,New Zealand Anzac Day Lest We Forget Sunset Collection,New Zealand Anzac Day Lest We Forget Sunset Collection,Sat Feb 08 2020 13:19:36 GMT+0700 (Indochina Time)
164665917520,4,New Zealand Rugby Collection,New Zealand Rugby Collection,Tue Jun 02 2020 15:36:15 GMT+0700 (Indochina Time)
165186502736,4,New Zealand Rugby Maori Collection,New Zealand Rugby Maori Collection,Thu Jun 18 2020 09:13:29 GMT+0700 (Indochina Time)
158604197968,4,New Zealand Warrior Fighter Maori,New Zealand Warrior Fighter Maori,Sat Jan 11 2020 14:02:19 GMT+0700 (Indochina Time)
160818069584,4,Norway Bandana Collection,Norway Bandana Collection,Fri Apr 10 2020 09:24:13 GMT+0700 (Indochina Time)
166958760016,4,Pan-African Proud Of My African Roots Collection,Pan-African Proud Of My African Roots Collection,Tue Jul 28 2020 17:10:59 GMT+0700 (Indochina Time)
164457218128,4,Papua New Guinea Coat Of Arms Polyneisan With Hibiscus And Waves,Papua New Guinea Coat Of Arms Polyneisan With Hibiscus And Waves,Wed May 27 2020 08:20:45 GMT+0700 (Indochina Time)
166883262544,4,Papua New Guinea Lauhala Polynesian Collection,Papua New Guinea Lauhala Polynesian Collection,Sat Jul 25 2020 16:50:36 GMT+0700 (Indochina Time)
159692128336,4,Papua New Guinea Rugby Collection,Papua New Guinea Rugby Collection,Thu Feb 27 2020 21:21:19 GMT+0700 (Indochina Time)
165763842128,4,Philippines Collection,Philippines Collection,Mon Jul 06 2020 13:37:25 GMT+0700 (Indochina Time)
162276671568,4,Poland Football Collection,Poland Football Collection,Wed Apr 29 2020 16:18:49 GMT+0700 (Indochina Time)
156445278288,4,Poland Great Eagle Style Collection,Poland Great Eagle Style Collection,Wed Nov 20 2019 17:08:15 GMT+0700 (Indochina Time)
157751443536,4,Polynesian Tattoo Collection,Polynesian Tattoo Collection,Mon Dec 09 2019 16:08:05 GMT+0700 (Indochina Time)
163824435280,4,Portugal Lavender Collection,Portugal Lavender Collection,Mon May 18 2020 11:23:04 GMT+0700 (Indochina Time)
166461931600,5,(Custom) Polynesian Banana Palm Leaves And Coconut Tree Personal Signature,(Custom) Polynesian Banana Palm Leaves And Coconut Tree Personal Signature,Thu Jul 23 2020 09:30:42 GMT+0700 (Indochina Time)
157450698832,5,Albania Eagle Collection,Albania Eagle Collection,Wed Dec 04 2019 14:16:59 GMT+0700 (Indochina Time)
164720869456,5,Albania in Me Collection,Albania in Me Collection,Thu Jun 04 2020 09:06:32 GMT+0700 (Indochina Time)
160670777424,5,All Items About Arizona,All Items About Arizona,Tue Apr 07 2020 17:28:30 GMT+0700 (Indochina Time)
166951288912,5,All Items About Chuuk,All Items About Chuuk,Tue Jul 28 2020 10:59:07 GMT+0700 (Indochina Time)
164195008592,5,American Samoa Polynesian Coat Of Arms Collection,American Samoa Polynesian Coat Of Arms Collection,Fri May 22 2020 14:51:39 GMT+0700 (Indochina Time)
163534241872,5,American Samoan Eagle,American Samoan Eagle,Thu May 14 2020 07:49:08 GMT+0700 (Indochina Time)
163286843472,5,Australia Aboriginal - Naidoc Week Collection,Australia Aboriginal - Naidoc Week Collection,Mon May 11 2020 13:37:31 GMT+0700 (Indochina Time)
159949848656,5,Australia Basbeball Team Clothing,Australia Basbeball Team Clothing,Tue Mar 10 2020 14:56:37 GMT+0700 (Indochina Time)
165979258960,5,Australia Five Stars Clothing,Australia Five Stars Clothing,Wed Jul 15 2020 11:44:05 GMT+0700 (Indochina Time)
165770362960,5,Australia Kangaroo Spirit,Australia Kangaroo Spirit,Mon Jul 06 2020 18:45:32 GMT+0700 (Indochina Time)
160266420304,5,Australian Aboriginal Balaclava Collection,Australian Aboriginal Balaclava Collection,Fri Mar 27 2020 16:39:11 GMT+0700 (Indochina Time)
158818238544,5,Bosnia And Herzegovina Lightning Collection,Bosnia And Herzegovina Lightning Collection,Tue Jan 21 2020 18:12:30 GMT+0700 (Indochina Time)
161256996944,5,Celtic Knot Galaxy Purple Collection,Celtic Knot Galaxy Purple Collection,Thu Apr 16 2020 08:42:08 GMT+0700 (Indochina Time)
158818304080,5,Chile Lightning Collection,Chile Lightning Collection,Tue Jan 21 2020 18:14:07 GMT+0700 (Indochina Time)
164540842064,5,Chuuk Polynesian Coat Of Arms Collections,Chuuk Polynesian Coat Of Arms Collections,Fri May 29 2020 15:50:17 GMT+0700 (Indochina Time)
164876484688,5,Cook Islands Polynesian Coat Of Arms Collections,Cook Islands Polynesian Coat Of Arms Collections,Wed Jun 10 2020 08:22:23 GMT+0700 (Indochina Time)
164065050704,5,Croatia Hrvatska Map And Coat Of Arms Collection,Croatia Hrvatska Map And Coat Of Arms Collection,Wed May 20 2020 20:04:52 GMT+0700 (Indochina Time)
160324354128,5,Custom Central African Republic Rising,Custom Central African Republic Rising,Mon Mar 30 2020 09:46:44 GMT+0700 (Indochina Time)
159788564560,5,Dominican Republic Baseball Team Clothing,Dominican Republic Baseball Team Clothing,Wed Mar 04 2020 09:29:31 GMT+0700 (Indochina Time)
158818402384,5,Dominican Republic Lightning Collection,Dominican Republic Lightning Collection,Tue Jan 21 2020 18:14:39 GMT+0700 (Indochina Time)
158818467920,5,Estonia Lightning Collection,Estonia Lightning Collection,Tue Jan 21 2020 18:18:39 GMT+0700 (Indochina Time)
164177739856,5,Fiji Polynesian Coconut Tree Collection,Fiji Polynesian Coconut Tree Collection,Fri May 22 2020 07:55:36 GMT+0700 (Indochina Time)
158818533456,5,Gambia Lightning Collection,Gambia Lightning Collection,Tue Jan 21 2020 18:21:07 GMT+0700 (Indochina Time)
165817843792,5,Gods Of Egypt Bedding Set Collection,Gods Of Egypt Bedding Set Collection,Wed Jul 08 2020 10:51:03 GMT+0700 (Indochina Time)
158818631760,5,Grenada Lightning Collection,Grenada Lightning Collection,Tue Jan 21 2020 18:23:08 GMT+0700 (Indochina Time)
164252581968,5,Guam Polynesian Coat of Arms Collection,Guam Polynesian Coat of Arms Collection,Sat May 23 2020 13:20:36 GMT+0700 (Indochina Time)
164372971600,5,Hawaii Polynesian Cost Of Arms,Hawaii Polynesian Cost Of Arms,Mon May 25 2020 11:39:00 GMT+0700 (Indochina Time)
164661133392,5,I Can't Breathe Collection,I Can't Breathe Collection,Tue Jun 02 2020 10:04:47 GMT+0700 (Indochina Time)
160823378000,5,Iceland Bandana Collection,Iceland Bandana Collection,Fri Apr 10 2020 09:44:55 GMT+0700 (Indochina Time)
159072026704,5,Ireland Celtic Shamrock Special,Ireland Celtic Shamrock Special,Wed Feb 05 2020 11:48:20 GMT+0700 (Indochina Time)
159525044304,5,Ireland Drinking Team Clothing,Ireland Drinking Team Clothing,Wed Feb 19 2020 10:20:15 GMT+0700 (Indochina Time)
164428349520,5,Kiribati Polynesian Cost Of Arms Collections,Kiribati Polynesian Cost Of Arms Collections,Tue May 26 2020 11:31:23 GMT+0700 (Indochina Time)
164876550224,5,Kosrae Polynesian Coat Of Arms Collections,Kosrae Polynesian Coat Of Arms Collections,Wed Jun 10 2020 08:22:23 GMT+0700 (Indochina Time)
166310215760,5,Leicestershire Foxes Cricket Clothing,Leicestershire Foxes Cricket Clothing,Wed Jul 22 2020 15:37:37 GMT+0700 (Indochina Time)
161389903952,5,Luxembourg Mouth Mask Collection,Luxembourg Mouth Mask Collection,Sat Apr 18 2020 08:04:07 GMT+0700 (Indochina Time)
164876681296,5,Marquesas Islands Polynesian Coat Of Arms Collections,Marquesas Islands Polynesian Coat Of Arms Collections,Wed Jun 10 2020 08:22:23 GMT+0700 (Indochina Time)
164666474576,5,Marshall Islands Polynesian Coat Of Arms Collections,Marshall Islands Polynesian Coat Of Arms Collections,Tue Jun 02 2020 15:57:06 GMT+0700 (Indochina Time)
164876746832,5,Nauru Polynesian Coat Of Arms Collections,Nauru Polynesian Coat Of Arms Collections,Wed Jun 10 2020 08:22:23 GMT+0700 (Indochina Time)
160529023056,5,New Zealand Anzac Day Lest We Forget,New Zealand Anzac Day Lest We Forget,Sat Apr 04 2020 22:02:18 GMT+0700 (Indochina Time)
165796610128,5,Ni-Vanuatu Collection,Ni-Vanuatu Collection,Tue Jul 07 2020 18:41:18 GMT+0700 (Indochina Time)
164876779600,5,Niue Polynesian Coat Of Arms Collections,Niue Polynesian Coat Of Arms Collections,Wed Jun 10 2020 08:22:23 GMT+0700 (Indochina Time)
164434509904,5,Northern Mariana Islands Polynesian Cost Of Arms Collections,Northern Mariana Islands Polynesian Cost Of Arms Collections,Tue May 26 2020 19:08:06 GMT+0700 (Indochina Time)
161349795920,5,Norway Mouth Mask Collection,Norway Mouth Mask Collection,Fri Apr 17 2020 17:40:50 GMT+0700 (Indochina Time)
166288654416,5,Pakistan Cricket Clothing,Pakistan Cricket Clothing,Tue Jul 21 2020 16:49:07 GMT+0700 (Indochina Time)
164877008976,5,Palau Polynesian Coat Of Arms Collections,Palau Polynesian Coat Of Arms Collections,Wed Jun 10 2020 08:22:23 GMT+0700 (Indochina Time)
166535102544,5,Pan-African Resistance and Solidarity Flag Collection,Pan-African Resistance and Solidarity Flag Collection,Thu Jul 23 2020 14:25:30 GMT+0700 (Indochina Time)
164462297168,5,Papua New Guinea Polynesian Cost Of Arms Collections,Papua New Guinea Polynesian Cost Of Arms Collections,Wed May 27 2020 11:35:46 GMT+0700 (Indochina Time)
160220217424,5,Philadelphia Baseball Collection,Philadelphia Baseball Collection,Wed Mar 25 2020 14:16:18 GMT+0700 (Indochina Time)
160331890768,5,Pittsburgh Baseball Collection,Pittsburgh Baseball Collection,Mon Mar 30 2020 19:29:28 GMT+0700 (Indochina Time)
164877074512,5,Pohnpei Polynesian Coat Of Arms Collections,Pohnpei Polynesian Coat Of Arms Collections,Wed Jun 10 2020 08:22:23 GMT+0700 (Indochina Time)
161578287184,5,Portugal Face Mask Collection,Portugal Face Mask Collection,Tue Apr 21 2020 10:07:39 GMT+0700 (Indochina Time)
159750520912,6,Albania Knight Collection,Albania Knight Collection,Mon Mar 02 2020 17:14:11 GMT+0700 (Indochina Time)
160846839888,6,Albania Mouth Mask Collection,Albania Mouth Mask Collection,Fri Apr 10 2020 20:18:28 GMT+0700 (Indochina Time)
165596954704,6,Algeria - Tunisia Active Flag Collection,Algeria - Tunisia Active Flag Collection,Wed Jul 01 2020 16:47:00 GMT+0700 (Indochina Time)
160289259600,6,All Items About Baltimore,All Items About Baltimore,Sat Mar 28 2020 10:46:38 GMT+0700 (Indochina Time)
160292601936,6,All Items About Oakland,All Items About Oakland,Sat Mar 28 2020 16:25:08 GMT+0700 (Indochina Time)
163825123408,6,American Samoa Bedding Set Collection,American Samoa Bedding Set Collection,Mon May 18 2020 10:20:28 GMT+0700 (Indochina Time)
163627335760,6,American Samoa Polynesian With Coconut Tree Collection,American Samoa Polynesian With Coconut Tree Collection,Fri May 15 2020 09:57:57 GMT+0700 (Indochina Time)
165564907600,6,Australia Indigenous  - Naidoc Collection,Australia Indigenous  - Naidoc Collection,Tue Jun 30 2020 14:42:27 GMT+0700 (Indochina Time)
165757157456,6,Bahamas Flag Coat Of Arm Collection,Bahamas Flag Coat Of Arm Collection,Mon Jul 06 2020 10:45:21 GMT+0700 (Indochina Time)
161335509072,6,Bahamas Mouth Mask Collection,Bahamas Mouth Mask Collection,Fri Apr 17 2020 11:35:15 GMT+0700 (Indochina Time)
160380682320,6,BATH RUGS,BATH RUGS,Wed Apr 01 2020 17:51:52 GMT+0700 (Indochina Time)
160004571216,6,Bolivia Coat Of Arms Flag Collection,Bolivia Coat Of Arms Flag Collection,Fri Mar 13 2020 18:34:11 GMT+0700 (Indochina Time)
166185664592,6,"Collection Of Jewelry, Keychains, And Gifts On Eid al-Fitr Day","Collection Of Jewelry, Keychains, And Gifts On Eid al-Fitr Day",Mon Jul 20 2020 16:11:31 GMT+0700 (Indochina Time)
161587953744,6,Croatia Neck Gaiter Collection,Croatia Neck Gaiter Collection,Tue Apr 21 2020 13:57:48 GMT+0700 (Indochina Time)
164034969680,6,Croatia Rising Collection,Croatia Rising Collection,Wed May 20 2020 08:40:13 GMT+0700 (Indochina Time)
165198102608,6,Eritrea Map Kente Flag Collection,Eritrea Map Kente Flag Collection,Thu Jun 18 2020 23:45:07 GMT+0700 (Indochina Time)
